{
  "symbol": "9501.T",
  "span_years": 5,
  "split": {
    "train_start": "2020-10-05",
    "train_end": "2024-09-26",
    "valid_start": "2024-09-27",
    "valid_end": "2025-10-02"
  },
  "stats": {
    "growth_5y": 1.2893332926432293,
    "cagr_5y": 0.23844205294691334,
    "max_dd_5y": -0.4806320431539221,
    "max_dd_start_date": "2024-09-26",
    "max_dd_end_date": "2024-08-05",
    "dd_recovery_days_max": 976,
    "yearly_return_mean": 0.21944824613827887,
    "yearly_return_std": 0.3174001347098616
  },
  "features": {
    "returns": {
      "r_mean_w1": 0.0012412137086224408,
      "r_std_w1": 0.028138020819158897,
      "r_min_w1": -0.1481042627252468,
      "r_max_w1": 0.16230366492146597,
      "r_p50_w1": 0.0,
      "r_p90_w1": 0.030681982552266368,
      "r_mean_w5": 0.0061128862715730614,
      "r_std_w5": 0.06329060488515263,
      "r_min_w5": -0.2289544072291806,
      "r_max_w5": 0.3823255435440891,
      "r_p10_w5": -0.060869565217391286,
      "r_p25_w5": -0.03192699092492374,
      "r_p50_w5": -0.0012261912998127178,
      "r_p75_w5": 0.0352246429990799,
      "r_p90_w5": 0.0792682926829269,
      "r_mean_w10": 0.012026681154321262,
      "r_std_w10": 0.08821906371373953,
      "r_min_w10": -0.27928827239376974,
      "r_max_w10": 0.43107221006564544,
      "r_p10_w10": -0.08320273031866476,
      "r_p25_w10": -0.042786838849435294,
      "r_p50_w10": 0.0,
      "r_p75_w10": 0.05458246578086873,
      "r_p90_w10": 0.11374406271105753,
      "r_mean_w20": 0.024435605215028487,
      "r_std_w20": 0.12173500920506478,
      "r_min_w20": -0.3161336001628958,
      "r_max_w20": 0.6088560885608856,
      "r_p10_w20": -0.11178655859506925,
      "r_p25_w20": -0.05206272544916002,
      "r_p50_w20": 0.007105356151244413,
      "r_p75_w20": 0.08120102908257448,
      "r_p90_w20": 0.18281914436132352,
      "r_mean_w60": 0.08031306112692758,
      "r_std_w60": 0.19686843704886267,
      "r_min_w60": -0.3983263470637748,
      "r_max_w60": 0.7184210526315788,
      "r_p10_w60": -0.16737236971326458,
      "r_p25_w60": -0.06683918698165373,
      "r_p50_w60": 0.0682811101837022,
      "r_p75_w60": 0.2241274307320002,
      "r_p90_w60": 0.3426307855401549,
      "r_mean_w120": 0.17254228727697,
      "r_std_w120": 0.2772003903488269,
      "r_min_w120": -0.3207410686180565,
      "r_max_w120": 1.1986531986531985,
      "r_p10_w120": -0.14676011067481814,
      "r_p25_w120": -0.06484154965143252,
      "r_p50_w120": 0.1578901854072502,
      "r_p75_w120": 0.3481544994736034,
      "r_p90_w120": 0.5593283407261571,
      "r_mean_w252": 0.39205972251133614,
      "r_std_w252": 0.3199902741688788,
      "r_min_w252": -0.22003057170716267,
      "r_max_w252": 1.2835051546391751,
      "r_p10_w252": -0.003168637324101944,
      "r_p25_w252": 0.11033371509332807,
      "r_p50_w252": 0.37935393852268406,
      "r_p75_w252": 0.623991631698298,
      "r_p90_w252": 0.8316720620179788
    },
    "trend": {
      "sma_slope_mean_w5": 0.3822863027806386,
      "sma_slope_std_w5": 6.939218757072748,
      "ema_slope_mean_w5": 0.3791180107481697,
      "ema_slope_std_w5": 6.997762071621408,
      "above_sma_ratio_w5": 0.4764344262295082,
      "above_ema_ratio_w5": 0.47438524590163933,
      "sma_slope_mean_w10": 0.3730020716570426,
      "sma_slope_std_w10": 4.710467861188889,
      "ema_slope_mean_w10": 0.37239392193559545,
      "ema_slope_std_w10": 4.755092501461566,
      "above_sma_ratio_w10": 0.4713114754098361,
      "above_ema_ratio_w10": 0.4723360655737705,
      "sma_slope_mean_w20": 0.3925627640600484,
      "sma_slope_std_w20": 3.1296160995069333,
      "ema_slope_mean_w20": 0.37493863623976664,
      "ema_slope_std_w20": 3.2170099199626936,
      "above_sma_ratio_w20": 0.514344262295082,
      "above_ema_ratio_w20": 0.4969262295081967,
      "sma_slope_mean_w50": 0.4384146902525142,
      "sma_slope_std_w50": 1.972140364702248,
      "ema_slope_mean_w50": 0.41356823462164627,
      "ema_slope_std_w50": 1.9644668813796842,
      "above_sma_ratio_w50": 0.4989754098360656,
      "above_ema_ratio_w50": 0.5379098360655737,
      "sma_slope_mean_w100": 0.5520890438828838,
      "sma_slope_std_w100": 1.2747591132374803,
      "ema_slope_mean_w100": 0.4653092213707873,
      "ema_slope_std_w100": 1.3219643002867374,
      "above_sma_ratio_w100": 0.5286885245901639,
      "above_ema_ratio_w100": 0.6004098360655737,
      "sma_slope_mean_w200": 0.6287538681816809,
      "sma_slope_std_w200": 0.724246754878669,
      "ema_slope_mean_w200": 0.4746926735423098,
      "ema_slope_std_w200": 0.8457603733073035,
      "above_sma_ratio_w200": 0.5502049180327869,
      "above_ema_ratio_w200": 0.6936475409836066,
      "golden_cross_count_5_20": 32,
      "death_cross_count_5_20": 31,
      "golden_cross_count_10_20": 27,
      "death_cross_count_10_20": 27,
      "golden_cross_count_20_50": 9,
      "death_cross_count_20_50": 9,
      "golden_cross_count_50_200": 3,
      "death_cross_count_50_200": 4
    },
    "vol": {
      "atr_mean_w14": 18.74574391372917,
      "atr_std_w14": 10.317555183595156,
      "true_range_to_close_mean_w14": 0.03551422859781291,
      "true_range_to_close_std_w14": 0.01590616387473239,
      "atr_mean_w20": 18.68147333531426,
      "atr_std_w20": 9.872440806357137,
      "true_range_to_close_mean_w20": 0.0355200745970802,
      "true_range_to_close_std_w20": 0.016630837769331445,
      "atr_mean_w60": 18.12312915121536,
      "atr_std_w60": 8.21223275751479,
      "true_range_to_close_mean_w60": 0.035498595860112926,
      "true_range_to_close_std_w60": 0.01880257370818479,
      "hv_w20": 0.4170973143883413,
      "hv_w60": 0.4322994442221416,
      "hv_w120": 0.43690970704259346,
      "bb_width_mean_w20": 0.17013574941086104,
      "bb_width_p90_w20": 0.3044188316997968,
      "bb_squeeze_ratio_w20": 0.19672131147540983,
      "bb_expand_ratio_w20": 0.19672131147540983,
      "gap_abs_mean": 0.007842911045591091,
      "gap_down_p95": -0.022619554168735078,
      "gap_up_p95": 0.021373220384405936
    },
    "osc": {
      "rsi14_mean": 50.92251679503665,
      "rsi14_std": 11.676684525362134,
      "rsi14_gt70_ratio": 0.05737704918032787,
      "rsi14_lt30_ratio": 0.0235655737704918,
      "rsi14_stay80_3d_count": 6,
      "rci9_mean": 0.3360910031023766,
      "rci9_std": 65.07948629868588,
      "rci9_gt80_ratio": 0.15305067218200621,
      "rci9_lt_80_ratio": 0.1282316442605998,
      "rci9_cross_zero_count": 57,
      "rci26_mean": 2.4406657669815575,
      "rci26_std": 61.77252211205262,
      "rci26_gt80_ratio": 0.11157894736842106,
      "rci26_lt_80_ratio": 0.13473684210526315,
      "rci26_cross_zero_count": 24,
      "stoch_k_mean": 46.48128014777072,
      "stoch_k_std": 27.105412347542945,
      "stoch_k_gt80_ratio": 0.142263759086189,
      "stoch_k_lt20_ratio": 0.22637590861889928,
      "macd_hist_mean": -0.05408229107694329,
      "macd_hist_std": 4.930429567574995,
      "macd_hist_pos_streak_mean": 11.925,
      "macd_hist_neg_streak_mean": 11.525
    },
    "candle": {
      "engulfing_pos_count": 20,
      "engulfing_neg_count": 25,
      "doji_pos_count": 137,
      "doji_neg_count": 0,
      "doji_pos_next3d_winrate": 0.47435897435897434,
      "doji_pos_next3d_mean": 0.0004019811585374895
    },
    "volume": {
      "vol_mean": 31442686.782786883,
      "vol_std": 30303616.897567578,
      "vol_trend_slope_w20": 42387.20099682352,
      "vol_ma_ratio_mean_w5": 1.0104406768515135,
      "vol_ma_ratio_p90_w5": 1.458058387183766,
      "vol_ma_ratio_mean_w20": 1.0352778815232424,
      "vol_ma_ratio_p90_w20": 1.6774378201307574,
      "vol_ma_ratio_mean_w60": 1.0771368189846096,
      "vol_ma_ratio_p90_w60": 1.9163014066577626,
      "vol_z_mean": 5.824120784918854e-17,
      "vol_z_std": 1.0,
      "vol_z_p95": 2.057460283634253,
      "vol_spike_count_z1_5": 71,
      "vol_spike_next3d_mean": 0.0015162085425691812,
      "on_balance_volume_slope_w20": 2143000.0390494606,
      "money_flow_pos_ratio": 0.5229338934182234
    },
    "streak": {
      "up_streak_max": 8,
      "down_streak_max": 8,
      "up_streak_mean": 2.0436681222707422,
      "down_streak_mean": 2.0657894736842106,
      "up7_plus_count": 8,
      "down7_plus_count": 1,
      "r20_gt_25pct_count": 46,
      "r20_lt_neg20pct_count": 15,
      "r20_spike_next10d_mean": -0.044333009617816076,
      "crash_next10d_mean": 0.06548746676893615,
      "new_20d_high_count": 105,
      "new_20d_low_count": 115,
      "break_20d_high_next3d_winrate": 0.47191011235955055,
      "break_20d_low_next3d_winrate": 0.47191011235955055,
      "ytd_high_touch_count": 36,
      "ytd_low_touch_count": 12
    },
    "dd": {
      "daily_dd_max": -0.1481042627252468,
      "daily_dd_min": 0.0,
      "daily_dd_mean": -0.008955117265318025,
      "daily_dd_std": 0.015484366634859081,
      "daily_dd_p50": 0.0,
      "daily_dd_p75": 0.0,
      "daily_dd_p90": 0.0,
      "daily_dd_p95": 0.0,
      "daily_dd_p99": 0.0,
      "daily_dd_nonzero_ratio": 0.48258196721311475,
      "daily_dd_cluster_mean_days": 1.9707112970711298,
      "intraday_dd_max": -0.12276431051203773,
      "intraday_dd_mean": -0.016395275351842847,
      "intraday_dd_p95": -0.0011119872932966444,
      "crash_window_dd_p95_w5": -0.0021645021645021467,
      "crash_window_dd_p95_w20": -0.020588235294117685,
      "crash_window_dd_p95_w60": -0.040000000000000036,
      "rebound_after_dd_gt5pct_next5d_mean": 0.010951150508658412,
      "rebound_winrate_after_dd_gt5pct": 0.4666666666666667
    },
    "regime": {
      "adx14_mean": 25.515954822579072,
      "adx14_gt25_ratio": 0.4456967213114754,
      "bb_squeeze_days_ratio": 0.19672131147540983,
      "bb_expand_days_ratio": 0.19672131147540983,
      "weekday_return_mean_mon": 0.00044792828580702616,
      "weekday_return_mean_tue": 0.0026683460929070335,
      "weekday_return_mean_wed": -0.0005561987597683699,
      "weekday_return_mean_thu": 0.001235525463379314,